review_text,source
"This was the worst delivery experience ever. I am extremely disappointed and will never order again.",Customer Review
"The product quality is decent but the packaging could be improved.",Survey
"Absolutely loved it! The support team was fast, polite and solved everything perfectly.",Customer Review
"The app is okay. It works, but the interface feels average and confusing sometimes.",App Feedback
"I hate how slow the service is. This is unacceptable and frustrating.",Social Comment
"Good experience overall, but not extraordinary.",Survey
